{
  "schema": 1,
  "corpus_captured_on": "2026-09-21",
  "catalog_source_revision": "046414eec9315eb1500f2e68147aa281ab35873d",
  "minimum_packages": 50,
  "minimum_coverage_basis_points": 9500,
  "packages": [
    {
      "source_id": 3,
      "candidate_package": "dlcmerger",
      "curated_package": "dlc-merger",
      "name": "DLC Merger",
      "category": "PRE EET BGEE MODS",
      "observed_game_targets": [
        "bg2ee",
        "bgee",
        "eet",
        "iwdee",
        "pstee"
      ],
      "inclusion_reason": "required current reference profile and observed in counted corpus"
    },
    {
      "source_id": 4,
      "candidate_package": "eefixpack",
      "curated_package": "ee-fixpack",
      "name": "EE Fixpack",
      "category": "PRE EET BGEE MODS",
      "observed_game_targets": [
        "bg1",
        "bg2",
        "bg2ee",
        "bgee",
        "bgt",
        "ca",
        "eet",
        "how",
        "iwd",
        "iwd2",
        "iwd_in_bg2",
        "iwdee",
        "pst",
        "pstee",
        "soa",
        "sod",
        "tob",
        "totlm",
        "totsc",
        "tutu",
        "tutu_totsc"
      ],
      "inclusion_reason": "required current reference profile and observed in counted corpus"
    },
    {
      "source_id": 5,
      "candidate_package": "bg1ub",
      "curated_package": "bg1-unfinished-business",
      "name": "BG1 Unfinished Business",
      "category": "PRE EET BGEE MODS",
      "observed_game_targets": [],
      "inclusion_reason": "meets frozen weighted-selection coverage threshold"
    },
    {
      "source_id": 7,
      "candidate_package": "sirene",
      "name": "Sirene NPC",
      "category": "NEW NPC MODS",
      "observed_game_targets": [],
      "inclusion_reason": "meets frozen weighted-selection coverage threshold"
    },
    {
      "source_id": 8,
      "candidate_package": "drake",
      "name": "Drake NPC",
      "category": "NEW NPC MODS",
      "observed_game_targets": [],
      "inclusion_reason": "meets frozen weighted-selection coverage threshold"
    },
    {
      "source_id": 12,
      "candidate_package": "eet",
      "curated_package": "eet",
      "name": "Baldur's Gate: Enhanced Edition Trilogy",
      "category": "EET STARTS HERE",
      "observed_game_targets": [],
      "inclusion_reason": "required current reference profile and observed in counted corpus"
    },
    {
      "source_id": 13,
      "candidate_package": "bubb-revert-pathfinding",
      "name": "Revert Pathfinding",
      "category": "ENGINE",
      "observed_game_targets": [
        "bg2ee",
        "bgee",
        "eet",
        "iwdee"
      ],
      "inclusion_reason": "meets frozen weighted-selection coverage threshold"
    },
    {
      "source_id": 16,
      "candidate_package": "leui",
      "name": "Lefreut's Enhanced UI (BG2EE skin)",
      "category": "INTERFACE",
      "observed_game_targets": [],
      "inclusion_reason": "meets frozen weighted-selection coverage threshold"
    },
    {
      "source_id": 17,
      "candidate_package": "infinity-ui",
      "curated_package": "infinity-ui-plus-plus",
      "name": "Infinity UI",
      "category": "INTERFACE",
      "observed_game_targets": [
        "bg2ee",
        "bgee",
        "eet",
        "iwdee"
      ],
      "inclusion_reason": "required current reference profile and observed in counted corpus"
    },
    {
      "source_id": 18,
      "candidate_package": "eeuitweaks",
      "name": "EE UI Tweaks",
      "category": "INTERFACE",
      "observed_game_targets": [],
      "inclusion_reason": "meets frozen weighted-selection coverage threshold"
    },
    {
      "source_id": 20,
      "candidate_package": "eeex",
      "curated_package": "eeex",
      "name": "EEex",
      "category": "ENGINE",
      "observed_game_targets": [],
      "inclusion_reason": "required current reference profile and observed in counted corpus"
    },
    {
      "source_id": 21,
      "candidate_package": "bubb-spell-menu-extended",
      "curated_package": "bubbs-spell-menu",
      "name": "Bubb's Spell Menu Extended",
      "category": "INTERFACE",
      "observed_game_targets": [
        "bg2ee",
        "bgee",
        "eet",
        "iwdee"
      ],
      "inclusion_reason": "required current reference profile"
    },
    {
      "source_id": 24,
      "candidate_package": "bgeeclassicmovies",
      "name": "BG:EE Classic Movies",
      "category": "GRAPHICS",
      "observed_game_targets": [],
      "inclusion_reason": "meets frozen weighted-selection coverage threshold"
    },
    {
      "source_id": 25,
      "candidate_package": "bggo",
      "name": "Baldur's Gate Graphics Overhaul",
      "category": "GRAPHICS",
      "observed_game_targets": [],
      "inclusion_reason": "meets frozen weighted-selection coverage threshold"
    },
    {
      "source_id": 29,
      "candidate_package": "mih-fr",
      "name": "Made in Heaven: Fixes & Restorations",
      "category": "RESTORATIONS",
      "observed_game_targets": [],
      "inclusion_reason": "meets frozen weighted-selection coverage threshold"
    },
    {
      "source_id": 33,
      "candidate_package": "c-endlessbg1",
      "name": "Endless BG1 Mod",
      "category": "QUEST MODS BG1",
      "observed_game_targets": [],
      "inclusion_reason": "meets frozen weighted-selection coverage threshold"
    },
    {
      "source_id": 35,
      "candidate_package": "c-sodtweaks",
      "name": "Jastey's Tweaks",
      "category": "QUEST MODS BG1",
      "observed_game_targets": [],
      "inclusion_reason": "meets frozen weighted-selection coverage threshold"
    },
    {
      "source_id": 36,
      "candidate_package": "c-sodboabri",
      "name": "The Boareskyr Bridge Scene",
      "category": "QUEST MODS BG1",
      "observed_game_targets": [],
      "inclusion_reason": "meets frozen weighted-selection coverage threshold"
    },
    {
      "source_id": 37,
      "candidate_package": "imoen-forever",
      "name": "Imoen 4 Ever",
      "category": "QUEST MODS BG1",
      "observed_game_targets": [],
      "inclusion_reason": "meets frozen weighted-selection coverage threshold"
    },
    {
      "source_id": 40,
      "candidate_package": "bp-in-bg",
      "name": "Bonus Pack in Baldur's Gate",
      "category": "QUEST MODS BG1",
      "observed_game_targets": [
        "bgee",
        "eet"
      ],
      "inclusion_reason": "meets frozen weighted-selection coverage threshold"
    },
    {
      "source_id": 41,
      "candidate_package": "reflections",
      "name": "Reflections of Destiny",
      "category": "QUEST MODS BG1",
      "observed_game_targets": [
        "bg2ee",
        "eet"
      ],
      "inclusion_reason": "meets frozen weighted-selection coverage threshold"
    },
    {
      "source_id": 42,
      "candidate_package": "bgqe",
      "name": "Baldur's Gate Mini Quests and Encounters Modification",
      "category": "QUEST MODS BG1",
      "observed_game_targets": [
        "bgee",
        "bgt",
        "eet",
        "totsc",
        "tutu",
        "tutu_totsc"
      ],
      "inclusion_reason": "meets frozen weighted-selection coverage threshold"
    },
    {
      "source_id": 43,
      "candidate_package": "ac-quest",
      "name": "Ascalon's Questpack",
      "category": "QUEST MODS BG1",
      "observed_game_targets": [],
      "inclusion_reason": "meets frozen weighted-selection coverage threshold"
    },
    {
      "source_id": 44,
      "candidate_package": "extraexpandedenhancedencounters",
      "name": "Extra Enhanced Expanded Encounters!",
      "category": "QUEST MODS BG1",
      "observed_game_targets": [],
      "inclusion_reason": "meets frozen weighted-selection coverage threshold"
    },
    {
      "source_id": 46,
      "candidate_package": "c-brage",
      "name": "Brage's Redemption",
      "category": "QUEST MODS BG1",
      "observed_game_targets": [],
      "inclusion_reason": "meets frozen weighted-selection coverage threshold"
    },
    {
      "source_id": 47,
      "candidate_package": "bg1npc",
      "curated_package": "bg1-npc",
      "name": "The BG1NPC Project",
      "category": "QUEST MODS BG1",
      "observed_game_targets": [],
      "inclusion_reason": "meets frozen weighted-selection coverage threshold"
    },
    {
      "source_id": 49,
      "candidate_package": "ajantisbg1",
      "name": "Ajantis BG1 Expansion Modification",
      "category": "QUEST MODS BG1",
      "observed_game_targets": [],
      "inclusion_reason": "meets frozen weighted-selection coverage threshold"
    },
    {
      "source_id": 50,
      "candidate_package": "coranbgfriend",
      "name": "Coran's BG Extended Friendship Talks",
      "category": "QUEST MODS BG1",
      "observed_game_targets": [],
      "inclusion_reason": "meets frozen weighted-selection coverage threshold"
    },
    {
      "source_id": 51,
      "candidate_package": "xanbg1friend",
      "name": "Xan's Friendship Path",
      "category": "QUEST MODS BG1",
      "observed_game_targets": [],
      "inclusion_reason": "meets frozen weighted-selection coverage threshold"
    },
    {
      "source_id": 55,
      "candidate_package": "bg1re",
      "name": "Baldur's Gate Romantic Encounters Modification (BG1RE)",
      "category": "QUEST MODS BG1",
      "observed_game_targets": [],
      "inclusion_reason": "meets frozen weighted-selection coverage threshold"
    },
    {
      "source_id": 57,
      "candidate_package": "sirinescall",
      "name": "The Lure of the Sirine's Call",
      "category": "QUEST MODS BG1",
      "observed_game_targets": [],
      "inclusion_reason": "meets frozen weighted-selection coverage threshold"
    },
    {
      "source_id": 62,
      "candidate_package": "ub",
      "name": "Unfinished Business",
      "category": "QUEST MODS BG2",
      "observed_game_targets": [],
      "inclusion_reason": "meets frozen weighted-selection coverage threshold"
    },
    {
      "source_id": 63,